{
    "$schema": "/usr/local/phoenix_hypervisor/etc/phoenix_lxc_configs.schema.json",
    "nvidia_driver_version": "580.76.05",
    "nvidia_repo_url": "https://developer.download.nvidia.com/compute/cuda/repos/ubuntu2404/x86_64/",
    "nvidia_runfile_url": "https://us.download.nvidia.com/XFree86/Linux-x86_64/580.76.05/NVIDIA-Linux-x86_64-580.76.05.run",
    "lxc_configs": {
        "900": {
            "name": "BaseTemplate",
            "memory_mb": 2048,
            "cores": 2,
            "template": "/fastData/shared-iso/template/cache/ubuntu-24.04-standard_24.04-2_amd64.tar.zst",
            "storage_pool": "lxc-disks",
            "storage_size_gb": 32,
            "network_config": {
                "name": "eth0",
                "bridge": "vmbr0",
                "ip": "10.0.0.200/24",
                "gw": "10.0.0.1"
            },
            "mac_address": "52:54:00:AA:BB:CC",
            "gpu_assignment": "none",
            "portainer_role": "none",
            "unprivileged": true,
            "template_snapshot_name": "base-snapshot",
            "features": [
                "base_setup"
            ]
        },
        "901": {
            "name": "BaseTemplateGPU",
            "memory_mb": 2048,
            "cores": 2,
            "storage_pool": "lxc-disks",
            "storage_size_gb": 32,
            "network_config": {
                "name": "eth0",
                "bridge": "vmbr0",
                "ip": "10.0.0.201/24",
                "gw": "10.0.0.1"
            },
            "mac_address": "52:54:00:AA:BB:CD",
            "gpu_assignment": "0,1",
            "portainer_role": "none",
            "unprivileged": true,
            "template_snapshot_name": "gpu-snapshot",
            "clone_from_ctid": "900",
            "features": [
                "nvidia"
            ]
        },
        "902": {
            "name": "BaseTemplateDocker",
            "memory_mb": 2048,
            "cores": 2,
            "storage_pool": "lxc-disks",
            "storage_size_gb": 32,
            "network_config": {
                "name": "eth0",
                "bridge": "vmbr0",
                "ip": "10.0.0.202/24",
                "gw": "10.0.0.1"
            },
            "mac_address": "52:54:00:AA:BB:CE",
            "gpu_assignment": "none",
            "portainer_role": "none",
            "unprivileged": true,
            "template_snapshot_name": "docker-snapshot",
            "clone_from_ctid": "900",
            "features": [
                "docker"
            ]
        },
        "910": {
            "name": "Portainer",
            "memory_mb": 32768,
            "cores": 6,
            "storage_pool": "lxc-disks",
            "storage_size_gb": 128,
            "network_config": {
                "name": "eth0",
                "bridge": "vmbr0",
                "ip": "10.0.0.99/24",
                "gw": "10.0.0.1"
            },
            "mac_address": "52:54:00:67:89:99",
            "gpu_assignment": "none",
            "portainer_role": "server",
            "unprivileged": true,
            "clone_from_ctid": "902",
            "features": [
                "docker"
            ]
        },
        "920": {
            "name": "BaseTemplateVLLM",
            "memory_mb": 65000,
            "cores": 8,
            "storage_pool": "lxc-disks",
            "storage_size_gb": 96,
            "network_config": {
                "name": "eth0",
                "bridge": "vmbr0",
                "ip": "10.0.0.220/24",
                "gw": "10.0.0.1"
            },
            "mac_address": "52:54:00:AA:BB:D1",
            "gpu_assignment": "0,1",
            "unprivileged": true,
            "portainer_role": "none",
            "template_snapshot_name": "vllm-base-snapshot",
            "clone_from_ctid": "901",
            "features": [
                "vllm"
            ]
        },
        "950": {
            "name": "vllmQwen3Coder",
            "memory_mb": 40960,
            "cores": 8,
            "storage_pool": "lxc-disks",
            "storage_size_gb": 100,
            "network_config": {
                "name": "eth0",
                "bridge": "vmbr0",
                "ip": "10.0.0.150/24",
                "gw": "10.0.0.1"
            },
            "mac_address": "52:54:00:67:89:B0",
            "gpu_assignment": "0,1",
            "unprivileged": true,
            "portainer_role": "none",
            "clone_from_ctid": "920",
            "features": [
                "vllm"
            ],
            "application_script": "phoenix_hypervisor_lxc_950.sh"
        }
    }
}